product_id,product_name,price,description,category
1,Increase,730.94,Authority audience always force reality mission long.,Electronics
2,General,380.16,We here rock finally.,Toys
3,Evidence,59.57,Understand laugh right cell white.,Clothing
4,Reveal,997.07,Force event American agent term service.,Home & Garden
5,Else,542.13,Word develop up even.,Electronics
6,Away,219.27,Price well pattern security direction for current.,Electronics
7,Activity,177.27,Nor allow over though.,Home & Garden
8,Heart,286.98,Customer until group view trouble.,Books
9,Family,541.04,Never offer concern different likely party chair including.,Home & Garden
10,None,464.17,Across purpose notice without body community.,Home & Garden
11,Ability,727.77,Each bank before institution benefit across structure.,Clothing
12,Walk,488.88,Decide involve should crime first heavy wife apply.,Toys
13,Green,115.13,Major significant fact rather believe.,Toys
14,Yeah,435.98,Suffer evening half organization up worry tax.,Toys
15,Fire,24.03,Season interview tonight room senior require.,Books
16,Year,205.81,Fast dark beat their rich ok open.,Home & Garden
17,Care,783.92,Plan protect blue.,Toys
18,Particular,739.28,Kid really lawyer professor visit three.,Electronics
19,Fly,99.06,Meet small short tell.,Electronics
20,Doctor,848.87,None win respond letter ground by race.,Electronics
21,Middle,629.51,Cover view find carry.,Toys
22,Administration,576.7,Trial national increase.,Home & Garden
23,Off,540.77,Government improve probably mother practice certain.,Electronics
24,Real,365.87,Follow special inside challenge everything able.,Home & Garden
25,Star,357.72,Film every fund huge stuff as.,Electronics
26,Too,408.91,Clearly price toward wait management president might.,Books
27,Sound,91.68,Evening message lawyer center guy.,Electronics
28,Truth,125.96,Year few scientist long.,Toys
29,True,986.73,Study professional company bit for oil break.,Home & Garden
30,Sell,753.4,Bag product bank international if per.,Books
31,Down,348.11,Heart more position team claim lot.,Books
32,First,47.38,Return about art present.,Home & Garden
33,Skin,562.67,Fire reduce past couple teach where between million.,Clothing
34,Long,124.67,Consumer only chance wear enjoy.,Electronics
35,Well,222.69,Meeting foreign top agreement.,Toys
36,Government,757.6,Capital scientist late great.,Home & Garden
37,Easy,879.94,Discuss here season party born.,Clothing
38,Involve,594.02,Especially thank fill fight.,Home & Garden
39,Democrat,190.99,Red trouble raise girl cultural part agency model.,Home & Garden
40,Republican,153.97,Read statement capital soldier new song evidence.,Home & Garden
41,Huge,194.1,Very research family age.,Toys
42,Why,935.01,Seem phone very four age air.,Home & Garden
43,Stay,678.28,Religious scientist traditional here.,Toys
44,Adult,814.06,So environmental financial challenge.,Toys
45,Technology,625.68,For consider war kind week like you risk.,Books
46,Federal,3.42,Oil simply ground another describe.,Toys
47,Conference,19.16,Month various set positive reason.,Books
48,Machine,399.69,Something listen above free short.,Electronics
49,Rule,707.45,Book occur entire president mother stuff.,Books
50,Water,90.98,Rise development position east into.,Home & Garden
51,Heavy,256.09,Their sit evening.,Clothing
52,Defense,717.33,World president position Congress just than.,Clothing
53,Stay,101.32,Light issue it stay.,Toys
54,Measure,180.87,Board south fire continue require anything soon.,Toys
55,Full,637.93,Surface history police travel Republican property sometimes.,Home & Garden
56,Property,328.43,Note agent do less foreign figure city from.,Electronics
57,Couple,818.64,Better entire bad art fine particularly debate.,Electronics
58,Lose,935.92,Rather begin hundred type could truth pass.,Books
59,Assume,546.27,Development service mean property manager.,Electronics
60,Task,535.21,Beat threat trial beat pressure way.,Toys
61,Ten,315.82,Send before pressure.,Toys
62,Budget,608.61,Rock forward only whether strategy.,Electronics
63,Most,740.28,Challenge director page control do manage move.,Clothing
64,Chance,68.59,Training keep most outside often red.,Electronics
65,Position,292.23,Make ground car very reach article method goal.,Books
66,Mother,439.9,Approach they hair upon inside large camera pull.,Clothing
67,Until,471.84,Occur others him building authority.,Books
68,Old,118.6,Medical where walk.,Books
69,Over,962.46,Wear six kind form player.,Electronics
70,Hotel,241.24,Wall third leave throughout then.,Home & Garden
71,Actually,63.62,Eat statement rock.,Electronics
72,Fine,350.19,Better resource while single magazine claim.,Electronics
73,Second,193.14,Pretty guy I perhaps region.,Electronics
74,Charge,112.33,Security foreign spring city third threat window.,Toys
75,Dark,16.32,Strong account officer budget.,Books
76,Painting,132.68,West might understand happy necessary sometimes laugh.,Books
77,Lose,487.79,Ahead mean husband notice shake well natural.,Clothing
78,For,945.4,Mother miss something side.,Toys
79,Often,124.45,Here relate car participant yet hotel.,Toys
80,Structure,803.94,Society serve hour foot station identify.,Electronics
81,Court,772.21,Gas better foot total admit federal.,Clothing
82,Player,30.66,Focus should skin news.,Books
83,Art,455.37,Reach somebody walk middle.,Electronics
84,Follow,196.38,Sea down require share heart hour.,Electronics
85,Plant,119.07,Practice near it.,Toys
86,Them,412.0,Real Mrs son return audience red down.,Home & Garden
87,Thus,258.01,Probably night use yet production parent simple.,Electronics
88,Both,600.3,Industry several discuss dog.,Clothing
89,None,880.31,Raise she feel car quickly movie cultural.,Toys
90,Have,42.37,Best example paper apply plant above medical.,Clothing
91,Hot,958.08,Around point industry party capital physical.,Books
92,During,187.31,Experience movement total available tough behind.,Clothing
93,Sister,880.32,Interview dream state expect community measure.,Home & Garden
94,Whole,925.51,End cut message leg.,Toys
95,Stuff,315.58,Over grow right.,Clothing
96,Image,450.79,Together once culture seven write table.,Toys
97,Everything,437.39,Have police behavior offer science alone.,Toys
98,Yeah,807.72,Hear sort boy upon ground.,Clothing
99,Front,500.69,Value available usually practice wind arrive.,Books
100,Weight,102.85,Organization board art cut may.,Home & Garden
